{
  "schema_version": "1.0.0",
  "screen": {
    "id": "DCCQ-1.2",
    "program": "DCCQ-1 Dynamic Capillary-Tissue-Cell Qualification",
    "version": "1.0.0",
    "performed_date": "2026-09-06",
    "status": "target-and-evidence-family-selected-before-equation-freeze",
    "parent_plan": "data/qualification/dynamic-capillary-tissue-cell-qualification-plan-v1.json",
    "parent_plan_sha256": "2b8a50677ec3dcdd400e85ad838244299d0b7e4e0aa6c9c98aabbe21e11c1958",
    "question": "Which named ligand-receptor-cell context provides the strongest auditable first target for a time-resolved, consumptive MEHLISSA capillary-tissue-cell coupling?",
    "selection_boundary": "Public articles, supporting information, repositories, exact revisions, file hashes, licences, units, and time-resolved observations were screened. No third-party code or data are bundled, no dynamic equations or acceptance limits are selected, no model output has been inspected, and no biological, pulmonary, patient, or clinical qualification is claimed.",
    "clinical_use": false
  },
  "criteria": [
    {
      "id": "biological-fit",
      "description": "The candidate names one ligand, receptor system, primary cellular context, and dynamic trafficking or consumption response."
    },
    {
      "id": "artifact-identity",
      "description": "The publication, model, code, and data can be identified by persistent locator, immutable revision, or content hash."
    },
    {
      "id": "unit-bridge",
      "description": "Source amounts, concentrations, volumes, surfaces, times, and rates are explicit enough for a prospective SI conversion."
    },
    {
      "id": "time-resolved-data",
      "description": "Time-resolved observations exist for the selected ligand-receptor process and their calibration or validation role can be declared."
    },
    {
      "id": "reuse-rights",
      "description": "Rights for articles, supporting information, data, and executable code are assessed independently rather than inferred from access."
    },
    {
      "id": "source-disjoint-evidence",
      "description": "A separately authored measurement family can challenge at least one dynamic behavior without refitting."
    },
    {
      "id": "pulmonary-context",
      "description": "The represented species, cell type, preparation, and physiological state support a pulmonary-capillary interpretation."
    },
    {
      "id": "bounded-integration",
      "description": "A reduced MEHLISSA-native reference can be specified without importing a complete third-party platform or widening the claim."
    }
  ],
  "candidates": [
    {
      "id": "DCCQ-SRC-001",
      "rank": 1,
      "decision": "selected-target-and-evidence-family",
      "name": "Sarabipour 2025 VEGF-A165a-VEGFR2-NRP1 ligand-responsive trafficking in HUVECs",
      "biology": {
        "ligand": "human vascular endothelial growth factor A isoform 165a (VEGF-A165a)",
        "receptors": [
          "vascular endothelial growth factor receptor 2 (VEGFR2/KDR)",
          "neuropilin-1 (NRP1) coreceptor"
        ],
        "cell_type": "primary human umbilical vein endothelial cells (HUVECs)",
        "preparation": "confluent serum-starved endothelial cell culture exposed to exogenous ligand",
        "dynamic_response": "ligand binding, surface loss, internalization into Rab4/5 and Rab11 compartments, recycling, and degradation",
        "physiological_scope": "human endothelial in vitro mechanism; not lung-specific, in vivo, patient-specific, or clinical"
      },
      "publication": {
        "citation": "Sarabipour S, Kinghorn K, Quigley KM, et al. Impact of ligand binding on VEGFR1, VEGFR2, and NRP1 localization in human endothelial cells. PLOS Computational Biology. 2025;21(7):e1013254.",
        "doi": "10.1371/journal.pcbi.1013254",
        "url": "https://journals.plos.org/ploscompbiol/article?id=10.1371/journal.pcbi.1013254",
        "article_and_supporting_information_rights": "CC-BY-4.0 with attribution; the paper states that all manuscript data are in the Supporting Information"
      },
      "artifacts": [
        {
          "id": "DCCQ-ART-001",
          "kind": "supporting-information",
          "role": "model parameters, compartment geometry, binding and trafficking definitions",
          "locator": "https://doi.org/10.1371/journal.pcbi.1013254.s012",
          "revision": "publication-version-2025-07-16",
          "path": "S12 Table and linked S14-S18 tables",
          "sha256": null,
          "licence": "CC-BY-4.0",
          "reuse_decision": "eligible-with-attribution"
        },
        {
          "id": "DCCQ-ART-002",
          "kind": "source-code",
          "role": "auditable full BioNetGen reference, not a source to copy",
          "locator": "https://github.com/SSarabipour/VEGFR-Trafficking-Projects",
          "revision": "bed7b23b3f6edbed6376e818b6307eccd65ea38e",
          "path": "Liganded Trafficking 2025/Bionetgen code/All_Lig_Traff_model_Bionetgen_20231016.bngl",
          "sha256": "2f5b245fdc11791c084b6c4e3cd3d9459c9b4de36f8f8e10a59762a7fa6c0007",
          "licence": "NOASSERTION",
          "reuse_decision": "inspection-and-hash-only-no-copy-or-redistribution"
        },
        {
          "id": "DCCQ-ART-003",
          "kind": "source-code",
          "role": "auditable generated MATLAB reference, not a source to copy",
          "locator": "https://github.com/SSarabipour/VEGFR-Trafficking-Projects",
          "revision": "bed7b23b3f6edbed6376e818b6307eccd65ea38e",
          "path": "Liganded Trafficking 2025/Matlab codes/All_Lig_Traff_model_Bionetgen_20231016.m",
          "sha256": "f093433e313aba387d8a52a594bef045b34c1503f227985db5d04d94b47d58fd",
          "licence": "NOASSERTION",
          "reuse_decision": "inspection-and-hash-only-no-copy-or-redistribution"
        },
        {
          "id": "DCCQ-ART-004",
          "kind": "source-data",
          "role": "repository copy of Figure 2C whole-cell time series; use the CC-BY Supporting Information as the rights-bearing source",
          "locator": "https://github.com/SSarabipour/VEGFR-Trafficking-Projects",
          "revision": "bed7b23b3f6edbed6376e818b6307eccd65ea38e",
          "path": "Liganded Trafficking 2025/R code/Figure 2 data and fig files/Fig2C_data.csv",
          "sha256": "0b04b0ccb76ee34417405170031894d3e46da4f82937731fc635799b5ab19c47",
          "licence": "NOASSERTION",
          "reuse_decision": "do-not-bundle-from-repository-use-cc-by-supporting-information"
        },
        {
          "id": "DCCQ-ART-005",
          "kind": "source-data",
          "role": "repository copy of Figure 2G one-hour surface, internal, and total measurements",
          "locator": "https://github.com/SSarabipour/VEGFR-Trafficking-Projects",
          "revision": "bed7b23b3f6edbed6376e818b6307eccd65ea38e",
          "path": "Liganded Trafficking 2025/R code/Figure 2 data and fig files/Fig2G_data.csv",
          "sha256": "22827653281ca0f9f4795beca4d63c8465334e07cdab8ec182fe497760f9793e",
          "licence": "NOASSERTION",
          "reuse_decision": "do-not-bundle-from-repository-use-cc-by-supporting-information"
        },
        {
          "id": "DCCQ-ART-006",
          "kind": "source-data",
          "role": "repository copy of Figure 2H four-hour surface, internal, and total measurements",
          "locator": "https://github.com/SSarabipour/VEGFR-Trafficking-Projects",
          "revision": "bed7b23b3f6edbed6376e818b6307eccd65ea38e",
          "path": "Liganded Trafficking 2025/R code/Figure 2 data and fig files/Fig2H_data.csv",
          "sha256": "d420d264568970f8fe205e8025a20b0319457172fd591bb1b4ae40ff70d52766",
          "licence": "NOASSERTION",
          "reuse_decision": "do-not-bundle-from-repository-use-cc-by-supporting-information"
        }
      ],
      "unit_assessment": {
        "source_amount": "molecules per represented cell",
        "source_time": "seconds",
        "source_volume": "femtolitres per represented cell, including 1e7 fL extracellular, 11.25 fL Rab4/5, and 3.75 fL Rab11",
        "source_surface": "square micrometres per represented cell, including 1000 um2 cell surface, 950 um2 Rab4/5, and 350 um2 Rab11",
        "source_rates": "first-order rates in s^-1 and association rates adjusted to molecules-per-cell, local volume, or local surface",
        "stimulus": "50 ng/mL VEGF-A165a is encoded as 6843182 molecules per represented cell for the source extracellular volume",
        "si_bridge_status": "convertible-but-not-yet-frozen",
        "required_dccq_1_3_decisions": [
          "freeze molecule-to-mole conversion using an explicit Avogadro constant",
          "freeze fL-to-m3 and um2-to-m2 conversions",
          "freeze the represented cell count and extracellular tissue volume",
          "freeze the VEGF-A165a molecular-mass and monomer-versus-dimer convention",
          "derive rather than silently reuse every adjusted association rate"
        ]
      },
      "data_role": "The 2025 HUVEC observations may select the mechanism, calibration values, transformations, and observation model. They cannot validate the resulting candidate because they belong to the same evidence family.",
      "scores": {
        "biological-fit": 3,
        "artifact-identity": 3,
        "unit-bridge": 3,
        "time-resolved-data": 3,
        "reuse-rights": 2,
        "source-disjoint-evidence": 2,
        "pulmonary-context": 1,
        "bounded-integration": 2
      },
      "total_score": 19,
      "strengths": [
        "Names a human endothelial ligand, receptor, coreceptor, cell preparation, and time-resolved trafficking response.",
        "The article and Supporting Information are CC-BY-4.0 and provide explicit parameters, compartment geometry, and experimental observations.",
        "The cited public repository can be pinned to one commit and its relevant files content-hashed.",